{
  "Type" : "Notification",
  "MessageId" : "90a62b4b-be0b-5508-a227-7aaf5731b865",
  "TopicArn" : "arn:aws:sns:us-east-1:614026612817:mytopicname",
  "Subject" : "Amazon SES Email Receipt Notification",
  "Message" : "{\"notificationType\":\"Received\",\"mail\":{\"timestamp\":\"2017-07-16T04:09:30.424Z\",\"source\":\"sarnobat.hotmail@gmail.com\",\"messageId\":\"hgd5c24al36j37i7cfjkjee7q0ol15mbj7i7ci01\",\"destination\":[\"test@atleticomadridhistory.com\"],\"headersTruncated\":false,\"headers\":[{\"name\":\"Return-Path\",\"value\":\"<sarnobat.hotmail@gmail.com>\"},{\"name\":\"Received\",\"value\":\"from mail-ua0-f193.google.com (mail-ua0-f193.google.com [209.85.217.193]) by inbound-smtp.us-east-1.amazonaws.com with SMTP id hgd5c24al36j37i7cfjkjee7q0ol15mbj7i7ci01 for test@atleticomadridhistory.com; Sun, 16 Jul 2017 04:09:30 +0000 (UTC)\"},{\"name\":\"X-SES-Spam-Verdict\",\"value\":\"PASS\"},{\"name\":\"X-SES-Virus-Verdict\",\"value\":\"PASS\"},{\"name\":\"Received-SPF\",\"value\":\"pass (spfCheck: domain of _spf.google.com designates 209.85.217.193 as permitted sender) client-ip=209.85.217.193; envelope-from=sarnobat.hotmail@gmail.com; helo=mail-ua0-f193.google.com;\"},{\"name\":\"Authentication-Results\",\"value\":\"amazonses.com; spf=pass (spfCheck: domain of _spf.google.com designates 209.85.217.193 as permitted sender) client-ip=209.85.217.193; envelope-from=sarnobat.hotmail@gmail.com; helo=mail-ua0-f193.google.com; dkim=pass header.i=@gmail.com;\"},{\"name\":\"X-SES-RECEIPT\",\"value\":\"AEFBQUFBQUFBQUFIL3BkanRsdHpIRjBtanlreEVhOURTa29FK2I0cHVaTmdjQitldnFjd091Wnl2eUl6Sjh3ZXlIR0R6VURjaE5kMEZOdVU5U05aUzJISGJ5V1ZFa0Y5d2hrNUVnVW9hL20vYjZNb1FRTEZWNjlSOXJEdlVYdGEwU0pLNlJ4NForNWxueVNweDRsakVKcHo4TEJRUzB0Tk13SmFzdGtoZ3lWOWNzeXNYTnFPYklCUzZiV21yem9zUVVEalBJZGF2RWZYMkRyUkdPbEY3c0RWbEorbFp3M0tHbGVxdXNtbHQvWEhsUUFqdVJ4cjNQMnlod2M0TVlFSTUxU1FaWk81MDFoVUFma2kwVG4vTTEyZHFibm9kRjhKUQ==\"},{\"name\":\"X-SES-DKIM-SIGNATURE\",\"value\":\"v=1; a=rsa-sha256; q=dns/txt; c=relaxed/simple; s=224i4yxa5dv7c2xz3womw6peuasteono; d=amazonses.com; t=1500178170; h=X-SES-RECEIPT:MIME-Version:From:Date:Message-ID:Subject:To:Content-Type; bh=Wou2GYYgi8VCy4gQGjPmW/QD65XKmj5KcAcrfLMKWmw=; b=NOx9apl5Z/YiOsgFynLAl55g0RF42s4U7PBCzkClN9/7e36iVeW6Q95acz/temGU 7o9te4HOwUCqimgPWtDPYh7uKgtEGrHSTq+me/RmZwctNAVqPkhJ5XvR6dYuc1Vzp/d tNVDp39MZpj575jr9Pk5nXG5IPVZLKxVQZxVxAZw=\"},{\"name\":\"Received\",\"value\":\"by mail-ua0-f193.google.com with SMTP id j53so9082363uaa.2 for <test@atleticomadridhistory.com>; Sat, 15 Jul 2017 21:09:30 -0700 (PDT)\"},{\"name\":\"DKIM-Signature\",\"value\":\"v=1; a=rsa-sha256; c=relaxed/relaxed; d=gmail.com; s=20161025; h=mime-version:sender:from:date:message-id:subject:to; bh=Wou2GYYgi8VCy4gQGjPmW/QD65XKmj5KcAcrfLMKWmw=; b=cU0cJbwIKN/w84S4At1whoPZ58JKOeSVG9JWpJznaXXjjp9e8J2Jg3LvDkxFbcY3cAEgJPO4xELJKswPMQ1G56UcA0A2ZfTfarKz0Kq/PxwfDcQ4fmNdy/IB8QxwiiSmx+wnyaCPiyUvzUN0h1SFQ+DXiwbsROwpccPaeVig5DJ5749UG55o2ZTKLKOlzvQiYT9Ze++O6VlvlqwTj05Gj7ToZB3bgZEMByq/ozZTIfluLD4qQzkobygetK3TI6vAbM632Yx1JQKCt0Eg22AAXhjA60N2agpMqfS2J8HiPM2LGk6a7PEwSLvVIAX7j6MVPkTfwWd1qjIAAL3F/XmNSQ==\"},{\"name\":\"X-Google-DKIM-Signature\",\"value\":\"v=1; a=rsa-sha256; c=relaxed/relaxed; d=1e100.net; s=20161025; h=x-gm-message-state:mime-version:sender:from:date:message-id:subject :to; bh=Wou2GYYgi8VCy4gQGjPmW/QD65XKmj5KcAcrfLMKWmw=; b=qkhnGnaislEoCorbsdAiBu29e3FAt0h6Hj+5nicU8cnMP1407rC0UIMz8XNvdWWCR0 8d07YMV8KLih55c1bORnC2xEJFYofVcJn+WCNgGJ5ksk1xzFusAYuIzGXfERWiCF9sVi 0RxVlLXzdKdIQFOKVwEsdZqPuy/SVAvP1A/0ZSl4VSs6mw59aXPVd3+QNkpJ81xvfGoR G6+HyPt/H0R2PVKoyDzjjct0fszx3t4iAXIhceBwsBW+UXBpwW3rFrjUZV6d+h2v0uee QPzQc3O8TgvHus2VIeXJFr2ObPb4bzG9OfwwbR22tIaQSfaiUYLyMKsX9CYqtPwYZM7i nKfg==\"},{\"name\":\"X-Gm-Message-State\",\"value\":\"AIVw113ITnGrAV8Zqf+HEqqPpSk/uKZUnl+RHEMw+w3y+qq7OFpWltVy CzpTe/6kiD2eviAkMcNYch67z2pHGpg1\"},{\"name\":\"X-Received\",\"value\":\"by 10.176.92.108 with SMTP id a44mr1097001uag.88.1500178169749; Sat, 15 Jul 2017 21:09:29 -0700 (PDT)\"},{\"name\":\"MIME-Version\",\"value\":\"1.0\"},{\"name\":\"Sender\",\"value\":\"sarnobat.hotmail@gmail.com\"},{\"name\":\"Received\",\"value\":\"by 10.159.61.39 with HTTP; Sat, 15 Jul 2017 21:08:59 -0700 (PDT)\"},{\"name\":\"From\",\"value\":\"Sridhar Sarnobat <sridhar.sarnobat@gmail.com>\"},{\"name\":\"Date\",\"value\":\"Sat, 15 Jul 2017 21:08:59 -0700\"},{\"name\":\"X-Google-Sender-Auth\",\"value\":\"kHkeUHCEnrn2N6pj0SANfqe1ugM\"},{\"name\":\"Message-ID\",\"value\":\"<CA+328FZpYR5WUcokNvFOzUU22EBAxNqr1A4EcbsS_s=35=2=1g@mail.gmail.com>\"},{\"name\":\"Subject\",\"value\":\"hello\"},{\"name\":\"To\",\"value\":\"test@atleticomadridhistory.com\"},{\"name\":\"Content-Type\",\"value\":\"multipart/alternative; boundary=\\\"f403043eea78e8658a0554677278\\\"\"}],\"commonHeaders\":{\"returnPath\":\"sarnobat.hotmail@gmail.com\",\"from\":[\"Sridhar Sarnobat <sridhar.sarnobat@gmail.com>\"],\"sender\":\"sarnobat.hotmail@gmail.com\",\"date\":\"Sat, 15 Jul 2017 21:08:59 -0700\",\"to\":[\"test@atleticomadridhistory.com\"],\"messageId\":\"<CA+328FZpYR5WUcokNvFOzUU22EBAxNqr1A4EcbsS_s=35=2=1g@mail.gmail.com>\",\"subject\":\"hello\"}},\"receipt\":{\"timestamp\":\"2017-07-16T04:09:30.424Z\",\"processingTimeMillis\":389,\"recipients\":[\"test@atleticomadridhistory.com\"],\"spamVerdict\":{\"status\":\"PASS\"},\"virusVerdict\":{\"status\":\"PASS\"},\"spfVerdict\":{\"status\":\"PASS\"},\"dkimVerdict\":{\"status\":\"PASS\"},\"action\":{\"type\":\"SNS\",\"topicArn\":\"arn:aws:sns:us-east-1:614026612817:mytopicname\",\"encoding\":\"UTF8\"}},\"content\":\"Return-Path: <sarnobat.hotmail@gmail.com>\\r\\nReceived: from mail-ua0-f193.google.com (mail-ua0-f193.google.com [209.85.217.193])\\r\\n by inbound-smtp.us-east-1.amazonaws.com with SMTP id hgd5c24al36j37i7cfjkjee7q0ol15mbj7i7ci01\\r\\n for test@atleticomadridhistory.com;\\r\\n Sun, 16 Jul 2017 04:09:30 +0000 (UTC)\\r\\nX-SES-Spam-Verdict: PASS\\r\\nX-SES-Virus-Verdict: PASS\\r\\nReceived-SPF: pass (spfCheck: domain of _spf.google.com designates 209.85.217.193 as permitted sender) client-ip=209.85.217.193; envelope-from=sarnobat.hotmail@gmail.com; helo=mail-ua0-f193.google.com;\\r\\nAuthentication-Results: amazonses.com;\\r\\n spf=pass (spfCheck: domain of _spf.google.com designates 209.85.217.193 as permitted sender) client-ip=209.85.217.193; envelope-from=sarnobat.hotmail@gmail.com; helo=mail-ua0-f193.google.com;\\r\\n dkim=pass header.i=@gmail.com;\\r\\nX-SES-RECEIPT: AEFBQUFBQUFBQUFIL3BkanRsdHpIRjBtanlreEVhOURTa29FK2I0cHVaTmdjQitldnFjd091Wnl2eUl6Sjh3ZXlIR0R6VURjaE5kMEZOdVU5U05aUzJISGJ5V1ZFa0Y5d2hrNUVnVW9hL20vYjZNb1FRTEZWNjlSOXJEdlVYdGEwU0pLNlJ4NForNWxueVNweDRsakVKcHo4TEJRUzB0Tk13SmFzdGtoZ3lWOWNzeXNYTnFPYklCUzZiV21yem9zUVVEalBJZGF2RWZYMkRyUkdPbEY3c0RWbEorbFp3M0tHbGVxdXNtbHQvWEhsUUFqdVJ4cjNQMnlod2M0TVlFSTUxU1FaWk81MDFoVUFma2kwVG4vTTEyZHFibm9kRjhKUQ==\\r\\nX-SES-DKIM-SIGNATURE: v=1; a=rsa-sha256; q=dns/txt; c=relaxed/simple;\\r\\n\\ts=224i4yxa5dv7c2xz3womw6peuasteono; d=amazonses.com; t=1500178170;\\r\\n\\th=X-SES-RECEIPT:MIME-Version:From:Date:Message-ID:Subject:To:Content-Type;\\r\\n\\tbh=Wou2GYYgi8VCy4gQGjPmW/QD65XKmj5KcAcrfLMKWmw=;\\r\\n\\tb=NOx9apl5Z/YiOsgFynLAl55g0RF42s4U7PBCzkClN9/7e36iVeW6Q95acz/temGU\\r\\n\\t7o9te4HOwUCqimgPWtDPYh7uKgtEGrHSTq+me/RmZwctNAVqPkhJ5XvR6dYuc1Vzp/d\\r\\n\\ttNVDp39MZpj575jr9Pk5nXG5IPVZLKxVQZxVxAZw=\\r\\nReceived: by mail-ua0-f193.google.com with SMTP id j53so9082363uaa.2\\r\\n        for <test@atleticomadridhistory.com>; Sat, 15 Jul 2017 21:09:30 -0700 (PDT)\\r\\nDKIM-Signature: v=1; a=rsa-sha256; c=relaxed/relaxed;\\r\\n        d=gmail.com; s=20161025;\\r\\n        h=mime-version:sender:from:date:message-id:subject:to;\\r\\n        bh=Wou2GYYgi8VCy4gQGjPmW/QD65XKmj5KcAcrfLMKWmw=;\\r\\n        b=cU0cJbwIKN/w84S4At1whoPZ58JKOeSVG9JWpJznaXXjjp9e8J2Jg3LvDkxFbcY3cA\\r\\n         EgJPO4xELJKswPMQ1G56UcA0A2ZfTfarKz0Kq/PxwfDcQ4fmNdy/IB8QxwiiSmx+wnya\\r\\n         CPiyUvzUN0h1SFQ+DXiwbsROwpccPaeVig5DJ5749UG55o2ZTKLKOlzvQiYT9Ze++O6V\\r\\n         lvlqwTj05Gj7ToZB3bgZEMByq/ozZTIfluLD4qQzkobygetK3TI6vAbM632Yx1JQKCt0\\r\\n         Eg22AAXhjA60N2agpMqfS2J8HiPM2LGk6a7PEwSLvVIAX7j6MVPkTfwWd1qjIAAL3F/X\\r\\n         mNSQ==\\r\\nX-Google-DKIM-Signature: v=1; a=rsa-sha256; c=relaxed/relaxed;\\r\\n        d=1e100.net; s=20161025;\\r\\n        h=x-gm-message-state:mime-version:sender:from:date:message-id:subject\\r\\n         :to;\\r\\n        bh=Wou2GYYgi8VCy4gQGjPmW/QD65XKmj5KcAcrfLMKWmw=;\\r\\n        b=qkhnGnaislEoCorbsdAiBu29e3FAt0h6Hj+5nicU8cnMP1407rC0UIMz8XNvdWWCR0\\r\\n         8d07YMV8KLih55c1bORnC2xEJFYofVcJn+WCNgGJ5ksk1xzFusAYuIzGXfERWiCF9sVi\\r\\n         0RxVlLXzdKdIQFOKVwEsdZqPuy/SVAvP1A/0ZSl4VSs6mw59aXPVd3+QNkpJ81xvfGoR\\r\\n         G6+HyPt/H0R2PVKoyDzjjct0fszx3t4iAXIhceBwsBW+UXBpwW3rFrjUZV6d+h2v0uee\\r\\n         QPzQc3O8TgvHus2VIeXJFr2ObPb4bzG9OfwwbR22tIaQSfaiUYLyMKsX9CYqtPwYZM7i\\r\\n         nKfg==\\r\\nX-Gm-Message-State: AIVw113ITnGrAV8Zqf+HEqqPpSk/uKZUnl+RHEMw+w3y+qq7OFpWltVy\\r\\n\\tCzpTe/6kiD2eviAkMcNYch67z2pHGpg1\\r\\nX-Received: by 10.176.92.108 with SMTP id a44mr1097001uag.88.1500178169749;\\r\\n Sat, 15 Jul 2017 21:09:29 -0700 (PDT)\\r\\nMIME-Version: 1.0\\r\\nSender: sarnobat.hotmail@gmail.com\\r\\nReceived: by 10.159.61.39 with HTTP; Sat, 15 Jul 2017 21:08:59 -0700 (PDT)\\r\\nFrom: Sridhar Sarnobat <sridhar.sarnobat@gmail.com>\\r\\nDate: Sat, 15 Jul 2017 21:08:59 -0700\\r\\nX-Google-Sender-Auth: kHkeUHCEnrn2N6pj0SANfqe1ugM\\r\\nMessage-ID: <CA+328FZpYR5WUcokNvFOzUU22EBAxNqr1A4EcbsS_s=35=2=1g@mail.gmail.com>\\r\\nSubject: hello\\r\\nTo: test@atleticomadridhistory.com\\r\\nContent-Type: multipart/alternative; boundary=\\\"f403043eea78e8658a0554677278\\\"\\r\\n\\r\\n--f403043eea78e8658a0554677278\\r\\nContent-Type: text/plain; charset=\\\"UTF-8\\\"\\r\\n\\r\\n\\r\\n\\r\\n--f403043eea78e8658a0554677278\\r\\nContent-Type: text/html; charset=\\\"UTF-8\\\"\\r\\n\\r\\n<div dir=\\\"ltr\\\"><div class=\\\"gmail_default\\\" style=\\\"font-family:verdana,sans-serif;color:#006600\\\"><br></div>\\r\\n</div>\\r\\n\\r\\n--f403043eea78e8658a0554677278--\\r\\n\"}",
  "Timestamp" : "2017-07-16T04:09:30.833Z",
  "SignatureVersion" : "1",
  "Signature" : "iNMjAlHYgXVP7VxRqEzhxRBYpWe+jlezHo6ZV+SYob2i5Q9iw5L543U33AczZ30S4KwtTvqd8gESjmxgrnmhtBaSEYqUVdo4bZgJBPBQqaWBVEHvwwtJzPKbzDes+r+8K922w48OJiA54AiKucjr+N3caD9ZtLaRWFdAL+q9tQ2b+MzCLgasTp9o0w9swdZUaZOYaCtu6GvkUacv8p55MxRKChcbzNKCnWUiztgn6X4Va+ktVpVVr/PLOFxZoIPPEOxqD1tGStgbIGNC6vnPOtvHt22Ql14iWzRfiuKxRgpzTaTZ/w4PYrTesAYnY93EYdG1j0KMWA+wZvA+he5XDA==",
  "SigningCertURL" : "https://sns.us-east-1.amazonaws.com/SimpleNotificationService-b95095beb82e8f6a046b3aafc7f4149a.pem",
  "UnsubscribeURL" : "https://sns.us-east-1.amazonaws.com/?Action=Unsubscribe&SubscriptionArn=arn:aws:sns:us-east-1:614026612817:mytopicname:cc106f11-bb15-43fc-a5b0-4ce7269ad529"
}
